{
  "$schema": "https://propertycommons.github.io/property-pack/schema/v1/bundle.schema.json",
  "$comment": "SPDX-License-Identifier: Apache-2.0. Synthetic conformance fixture: no real property, person or record. The smallest valid bundle: every required field, no optional sections, no components.",
  "schemaVersion": "ukpp.pack.v1",
  "bundleId": "bnd_EXAMPLE0001",
  "generatedAt": "2026-09-16T11:04:22Z",
  "recordId": "rec_EXAMPLE0001",
  "jurisdiction": "england",
  "audience": "buyer-conveyancer",
  "disclaimer": "Prepared voluntarily by the property owner using a self-service tool. Owner-declared items are not independently verified. No component is certified.",
  "property": {
    "uprn": "999999999999",
    "addressNormalised": "1 Example Street, Exampletown, ZZ99 9ZZ"
  },
  "components": []
}
